<?xml version="1.0" encoding="UTF-8"?>
<bucket xmlns="http://www.w3school.com.cn"
	xmlns:xsi="http://www.w3.org/2001/XMLSchema-instance"
	xsi:schemaLocation="http://www.w3school.com.cn ab.xsd" 
project="search">


	<layer strategy="hash" level="1">
		<part weight="10">a</part>
		<part weight="20">b</part>
		<part weight="0">a</part>
		<part weight="3">b</part>
	</layer>
	
	<layer strategy="hash" level="1" >
		<part weight="10">a</part>
		<part weight="20">b</part>
		<part weight="0">a</part>
		<part weight="3">b</part>
	</layer>





</bucket>